{
  "schema_version": 3,
  "revision": 0,
  "name": "Creator Lab",
  "scene": {
    "schema_version": 1,
    "revision": 0,
    "name": "Creator Lab",
    "gravity": [
      0,
      -9.81,
      0
    ],
    "fixed_dt": 0.016666666666666666,
    "bodies": [
      {
        "id": "floor",
        "motion": "static",
        "shape": {
          "type": "box",
          "half_extents": [
            7.4,
            0.4,
            6.4
          ]
        },
        "position": [
          0,
          -0.4,
          0
        ]
      },
      {
        "id": "west",
        "motion": "static",
        "shape": {
          "type": "box",
          "half_extents": [
            0.15,
            0.5,
            6.2
          ]
        },
        "position": [
          -7.15,
          0.5,
          0
        ]
      },
      {
        "id": "east",
        "motion": "static",
        "shape": {
          "type": "box",
          "half_extents": [
            0.15,
            0.5,
            6.2
          ]
        },
        "position": [
          7.15,
          0.5,
          0
        ]
      },
      {
        "id": "north",
        "motion": "static",
        "shape": {
          "type": "box",
          "half_extents": [
            7.3,
            0.5,
            0.15
          ]
        },
        "position": [
          0,
          0.5,
          -6.15
        ]
      },
      {
        "id": "south",
        "motion": "static",
        "shape": {
          "type": "box",
          "half_extents": [
            7.3,
            0.5,
            0.15
          ]
        },
        "position": [
          0,
          0.5,
          6.15
        ]
      },
      {
        "id": "gate_a",
        "motion": "static",
        "shape": {
          "type": "box",
          "half_extents": [
            5,
            0.65,
            0.24
          ]
        },
        "position": [
          -2,
          0.65,
          1
        ]
      },
      {
        "id": "gate_b",
        "motion": "static",
        "shape": {
          "type": "box",
          "half_extents": [
            5,
            0.65,
            0.24
          ]
        },
        "position": [
          2,
          0.65,
          -1.5
        ]
      },
      {
        "id": "goal",
        "motion": "static",
        "shape": {
          "type": "box",
          "half_extents": [
            1.2,
            0.035,
            1.2
          ]
        },
        "position": [
          5,
          0.035,
          -4
        ],
        "is_sensor": true
      },
      {
        "id": "player",
        "motion": "dynamic",
        "shape": {
          "type": "box",
          "half_extents": [
            0.42,
            0.42,
            0.42
          ]
        },
        "position": [
          -5,
          0.44,
          4
        ],
        "friction": 0.25,
        "allow_sleep": false
      }
    ]
  },
  "game": {
    "player": "player",
    "goal": "goal",
    "speed": 4,
    "logic": {
      "schema_version": 1,
      "start": "first_input",
      "rules": [
        {
          "id": "movement",
          "name": "Move with WASD / arrows",
          "enabled": true,
          "once": false,
          "trigger": {
            "type": "every_tick"
          },
          "conditions": [],
          "actions": [
            {
              "type": "move_player"
            }
          ]
        },
        {
          "id": "space_jump",
          "name": "Space gives an upward velocity",
          "enabled": true,
          "once": false,
          "trigger": {
            "type": "key_pressed",
            "key": "action"
          },
          "conditions": [],
          "actions": [
            {
              "type": "set_velocity",
              "body": "player",
              "linear": [
                0,
                6,
                0
              ]
            }
          ]
        },
        {
          "id": "landing",
          "name": "First floor contact gives one point",
          "enabled": true,
          "once": true,
          "trigger": {
            "type": "contact",
            "body_a": "player",
            "body_b": "floor",
            "kind": "started"
          },
          "conditions": [],
          "actions": [
            {
              "type": "add_score",
              "amount": 1
            }
          ]
        },
        {
          "id": "finish",
          "name": "Reach the goal with a point to win",
          "enabled": true,
          "once": true,
          "trigger": {
            "type": "goal_reached"
          },
          "conditions": [
            {
              "type": "score_at_least",
              "value": 1
            }
          ],
          "actions": [
            {
              "type": "win"
            }
          ]
        },
        {
          "id": "timeout",
          "name": "Finish within 30 seconds",
          "enabled": true,
          "once": true,
          "trigger": {
            "type": "timer",
            "ticks": 1800,
            "repeat": false
          },
          "conditions": [],
          "actions": [
            {
              "type": "lose"
            }
          ]
        }
      ]
    }
  },
  "scene_id": "courtyard",
  "next_scene": "second_room",
  "scenes": [
    {
      "id": "second_room",
      "scene": {
        "schema_version": 1,
        "revision": 0,
        "name": "Second Room",
        "gravity": [
          0,
          -9.81,
          0
        ],
        "fixed_dt": 0.016666666666666666,
        "bodies": [
          {
            "id": "floor",
            "motion": "static",
            "shape": {
              "type": "box",
              "half_extents": [
                7.4,
                0.4,
                6.4
              ]
            },
            "position": [
              0,
              -0.4,
              0
            ]
          },
          {
            "id": "west",
            "motion": "static",
            "shape": {
              "type": "box",
              "half_extents": [
                0.15,
                0.5,
                6.2
              ]
            },
            "position": [
              -7.15,
              0.5,
              0
            ]
          },
          {
            "id": "east",
            "motion": "static",
            "shape": {
              "type": "box",
              "half_extents": [
                0.15,
                0.5,
                6.2
              ]
            },
            "position": [
              7.15,
              0.5,
              0
            ]
          },
          {
            "id": "north",
            "motion": "static",
            "shape": {
              "type": "box",
              "half_extents": [
                7.3,
                0.5,
                0.15
              ]
            },
            "position": [
              0,
              0.5,
              -6.15
            ]
          },
          {
            "id": "south",
            "motion": "static",
            "shape": {
              "type": "box",
              "half_extents": [
                7.3,
                0.5,
                0.15
              ]
            },
            "position": [
              0,
              0.5,
              6.15
            ]
          },
          {
            "id": "gate_a",
            "motion": "static",
            "shape": {
              "type": "box",
              "half_extents": [
                5,
                0.65,
                0.24
              ]
            },
            "position": [
              -2,
              0.65,
              1
            ]
          },
          {
            "id": "gate_b",
            "motion": "static",
            "shape": {
              "type": "box",
              "half_extents": [
                5,
                0.65,
                0.24
              ]
            },
            "position": [
              2,
              0.65,
              -1.5
            ]
          },
          {
            "id": "goal",
            "motion": "static",
            "shape": {
              "type": "box",
              "half_extents": [
                1.2,
                0.035,
                1.2
              ]
            },
            "position": [
              5,
              0.035,
              4
            ],
            "is_sensor": true
          },
          {
            "id": "player",
            "motion": "dynamic",
            "shape": {
              "type": "box",
              "half_extents": [
                0.42,
                0.42,
                0.42
              ]
            },
            "position": [
              -5,
              0.44,
              4
            ],
            "friction": 0.25,
            "allow_sleep": false
          }
        ]
      },
      "game": {
        "player": "player",
        "goal": "goal",
        "speed": 4,
        "logic": {
          "schema_version": 1,
          "start": "first_input",
          "rules": [
            {
              "id": "movement",
              "name": "Move with WASD / arrows",
              "enabled": true,
              "once": false,
              "trigger": {
                "type": "every_tick"
              },
              "conditions": [],
              "actions": [
                {
                  "type": "move_player"
                }
              ]
            },
            {
              "id": "space_jump",
              "name": "Space gives an upward velocity",
              "enabled": true,
              "once": false,
              "trigger": {
                "type": "key_pressed",
                "key": "action"
              },
              "conditions": [],
              "actions": [
                {
                  "type": "set_velocity",
                  "body": "player",